{
    "id": "teachers-health-literacy",
    "short-title": "Teachers health literacy",
    "long-title": "Teachers and social workers not trained in health literacy",
    "alert-block": {
        "alert-type": "note",
        "alert-title": "Section under development",
        "alert-content": "If you would like to add your ideas please use [this form](http://example.com)"
    },
    "level": "system",
    "icon": "teacher, school, educator, classroom, instructor.svg",
    "sections": [
        {
            "short-title": "heading",
            "long-title": "What is the level being targeted?",
            "content-type": "section-choice",
            "content": [
                {
                    "choice-option": "Individual level",
                    "choice-subtitle": "Things that happen between individuals, like one-to-one support or care",
                    "content-type": "subsection",
                    "content": [
                        {
                            "short-title": "people-involved",
                            "long-title": "Who should be involved?",
                            "content-type": "list",
                            "content": [
                                "Teachers",
                                "Social workers"
                            ]
                        }
                    ]
                },
                {
                    "choice-option": "System level",
                    "choice-subtitle": "Big system-wide things, like national policies or data systems",
                    "short-title": "help",
                    "long-title": "What would help?",
                    "content-type": "subsection",
                    "content": [
                        {
                            "short-title": "people-involved",
                            "long-title": "Who should be involved?",
                            "content-type": "list",
                            "content": [
                                "The Teaching Regulation Agency (TRA)",
                                "The Social Work Regulation Authority (Social Work England)"
                            ]
                        },
                        {
                            "short-title": "causes",
                            "long-title": "What are the causes of the problem?",
                            "content-type": "list",
                            "content": [
                                "There is poor awareness of the need for health literacy in training for teaching and social work professionals"
                            ]
                        },
                        {
                            "short-title": "help",
                            "long-title": "What would help to solve the problem?",
                            "content-type": "list",
                            "content": [
                                "Government guidance for regulatory bodies"
                            ]
                        },
                        {
                            "short-title": "actions",
                            "long-title": "What actions are involved in doing something about this?",
                            "content-type": "list",
                            "content": [
                                "Talking with the government about the problem",
                                "Change in government policy",
                                "Talking with regulatory bodies"
                            ]
                        },
                        {
                            "short-title": "delivery",
                            "long-title": "How will we deliver these actions?",
                            "content-type": "list",
                            "content": [
                                "Writing policy briefs about the issues",
                                "Meeting with key people (e.g. ministers, civil servants, regulatory bodies)"
                            ]
                        },
                        {
                            "short-title": "action-outcome",
                            "long-title": "What do we expect to come out of these actions?",
                            "content-type": "list",
                            "content": [
                                "Health literacy training will be embedded in teaching and social work professional training"
                            ]
                        },
                        {
                            "short-title": "change-marker",
                            "long-title": "How will we know things have changed?",
                            "content-type": "list",
                            "content": [
                                "Health literacy appears in teaching and social work training"
                            ]
                        },
                        {
                            "short-title": "short-term-change",
                            "long-title": "What will have changed in 1 year?",
                            "content-type": "list",
                            "content": [
                                "Policy brief will be given to ministers"
                            ]
                        },
                        {
                            "short-title": "long-term-change",
                            "long-title": "What will have happened in 3 years?",
                            "content-type": "list",
                            "content": [
                                "More teaching and public health professions will be starting to learn about health literacy as they train"
                            ]
                        }
                    ]
                }
            ]
        },
        {
            "short-title": "current-activities",
            "long-title": "What are the current activities in this area?",
            "content-type": "project-list",
            "content": [
                {
                    "short-title": "project-1",
                    "long-title": "Project one!",
                    "content-type": "project",
                    "project-email": "project@email.com"
                },
                {
                    "short-title": "project-2",
                    "long-title": "Project two!",
                    "content-type": "project",
                    "project-email": "project2@email.com"
                }
            ]
        }
    ]
}
